filename,date,publisher,title,beschreibung,title,description,group,credit
2021-03-05-frontiers-in-public-health_fpubh.2021.624559.md,2021-03-05,Frontiers in Public Health,Der Einfluss des Vitamin-D-Spiegels auf die COVID-19-Infektion: Systematische Überprüfung und Meta-Analyse,"Die Coronavirus-Krankheit (COVID-19) ist eine Erkrankung der Atemwege und des -systems, die durch das Schwere Akute Respiratorische Syndrom Coronavirus 2 (SARS-CoV-2) oder neuartige Coronaviren (nCoV) verursacht wird. Bis heute gibt es keine nachweislich heilende Behandlung für dieses Virus, so dass die Prävention nach wie vor die beste Strategie zur Bekämpfung der Coronavirus-Infektion (COVID-19) ist. Es wird angenommen, dass Vitamin-D-Mangel eine Rolle bei der Infektion mit dem Coronavirus (COVID-19) spielt, jedoch gibt es keine schlüssigen Beweise für seine Auswirkungen auf die COVID-19-Infektion. Ziel der vorliegenden Übersichtsarbeit war daher, die verfügbaren Erkenntnisse über den Zusammenhang zwischen dem Vitamin-D-Spiegel und dem Risiko einer COVID-19-Infektion zusammenzufassen. Eine systematische Literaturrecherche in Datenbanken (PUBMED/MEDLINE, Cochrane/Wiley library, Scopus und SciELO) wurde vom 15. Mai 2020 bis zum 20. Dezember 2020 durchgeführt. Studien, die die Wirkung des Vitamin-D-Spiegels auf die COVID-19/SARS-2-Infektion untersuchten, wurden für die Überprüfung berücksichtigt. Die Qualität der eingeschlossenen Studien wurde mithilfe der JBI-Tools bewertet. Es wurde eine Meta-Analyse mit einem Modell mit zufälligen Effekten durchgeführt, und es wurden Odds Ratio mit 95%CI berichtet. Diese systematische Übersichtsarbeit und die Meta-Analyse wurden gemäß der PRISMA-Richtlinie (Preferred Reporting Items for Systematic Review and Meta-Analysis) durchgeführt. Die elektronischen und ergänzenden Recherchen für diese Überprüfung ergaben 318 Datensätze, von denen nur 14 die Einschlusskriterien erfüllten. Die qualitative Synthese deutete darauf hin, dass Personen mit Vitamin-D-Mangel ein höheres Risiko für eine COVID-19-Infektion hatten als Patienten mit ausreichender Vitamin-D-Versorgung. Die gepoolte Analyse ergab, dass bei Personen mit Vitamin-D-Mangel die Wahrscheinlichkeit einer COVID-19-Infektion um 80 % höher war als bei Personen mit ausreichendem Vitamin-D-Spiegel. Der Begg-Test ergab außerdem, dass zwischen den Studien keine signifikante Publikationsverzerrung bestand. Die Subgruppenanalyse ergab, dass das Risiko, eine COVID-19-Infektion zu erwerben, im Fall-Kontroll-Studiendesign relativ höher war. Zusammenfassend lässt sich sagen, dass ein niedriger Serum-25(OH)-Vitamin-D-Spiegel signifikant mit einem höheren Risiko für eine COVID-19-Infektion verbunden war. Die begrenzten derzeit verfügbaren Daten deuten darauf hin, dass ein ausreichender Vitamin-D-Spiegel im Serum mit einem deutlich verringerten Risiko einer COVID-19-Infektion verbunden ist.",The Impact of Vitamin D Level on COVID-19 Infection: Systematic Review and Meta-Analysis,"Coronavirus disease (COVID-19) is a respiratory and systemic disorder caused by Severe Acute Respiratory Syndrome Coronavirus 2 (SARS-CoV-2) or novel Coronavirus (nCoV). To date, there is no proven curative treatment for this virus; as a result, prevention remains to be the best strategy to combat coronavirus infection (COVID-19). Vitamin D deficiency (VDD) has been proposed to play a role in coronavirus infection (COVID-19). However, there is no conclusive evidence on its impact on COVID-19 infection. Therefore, the present review aimed to summarize the available evidence regarding the association between Vitamin D levels and the risk of COVID-19 infection. A systematic literature search of databases (PUBMED/MEDLINE, Cochrane/Wiley library, Scopus, and SciELO) were conducted from May 15, 2020, to December 20, 2020. Studies that assessed the effect of vitamin D level on COVID-19/SARS-2 infection were considered for the review. The qualities of the included studies were evaluated using the JBI tools. Meta-analysis with a random-effects model was conducted and odds ratio with their 95%CI were reported. This systematic review and meta-analysis are reported according to the preferred reporting items for systematic review and meta-analysis (PRISMA) guideline. The electronic and supplementary searches for this review yielded 318 records from which, only 14 of them met the inclusion criteria. The qualitative synthesis indicated that vitamin D deficient individuals were at higher risk of COVID-19 infection as compared to vitamin D sufficient patients. The pooled analysis showed that individuals with Vitamin-D deficiency were 80% more likely to acquire COVID-19 infection as compared to those who have sufficient Vitamin D levels. Begg’s test also revealed that there was no significant publication bias between the studies (P = 0.764). The subgroup analysis revealed that the risk of acquiring COVID-19 infection was relatively higher in the case-control study design. In conclusion, low serum 25 (OH) Vitamin-D level was significantly associated with a higher risk of COVID-19 infection. The limited currently available data suggest that sufficient Vitamin D level in serum is associated with a significantly decreased risk of COVID-19 infection.",Therapeutics,https://www.frontiersin.org/articles/10.3389/fpubh.2021.624559/full
2021-03-08-frontiers-in-immunology_fimmu.2021.648546.md,2021-03-08,Frontiers in Immunology,Vitamin D in Corona Virus Disease 2019 (COVID-19) Related Multisystem Inflammatory Syndrome in Children (MIS-C),"Das Multisystem-Entzündungssyndrom bei Kindern (MIS-C) ist eine seltene, aber verheerende Komplikation der Coronavirus-Krankheit 19 (COVID-19). Die Entwicklung von prognostischen Biomarkern und, was noch wichtiger ist, die Einführung neuer Behandlungsmodalitäten würde sich in der klinischen Praxis erheblich auf den Ausgang von MIS-C auswirken. Vitamin D könnte ein potenzieller Kandidat sein. In diesem Mini-Review analysieren wir die immunmodulatorische Rolle von Vitamin D bei Virusinfektionen und speziell bei COVID-19. Außerdem untersuchen wir die aktuelle Literatur über den Zusammenhang zwischen Vitamin D und MIS-C sowie der Kawasaki-Krankheit. Das Vitamin D wurde nicht nur als Biomarker, sondern auch als Nahrungsergänzungsmittel bewertet. Wir kamen zu dem Schluss, dass der Vitamin-D-Spiegel bei der Vorhersage schwerer Formen von MIS-C wertvoll sein könnte und dass die Korrektur abnormaler Werte bei schwerem MIS-C dessen Entwicklung beeinflussen kann. Eine Supplementierung mit 25-Hydroxyvitamin D3 [25(OH)D3], die die [25(OH)D]-Konzentration im Serum erhöht, könnte sich unter bestimmten Umständen günstig auf die Verringerung des Schweregrads von MIS-C auswirken. Weitere Studien sind erforderlich, um diese Ergebnisse zu bestätigen.",Vitamin D in Corona Virus Disease 2019 (COVID-19) Related Multisystem Inflammatory Syndrome in Children (MIS-C),Multisystem Inflammatory Syndrome in children (MIS-C) is a rare but devastating complication of coronavirus disease 19 (COVID-19). The development of prognostic biomarkers and more importantly the implementation of new treatment modalities would have a significant impact in clinical practice regarding the outcome of MIS-C. Vitamin D could be a potential candidate. In this mini review we analyze the immunomodulatory role of vitamin D in viral infections and specifically in COVID-19. We also examine the current literature regarding the association of vitamin D with MIS-C and Kawasaki disease. The vitamin D was evaluated not only as a biomarker but also as a nutritional supplement. We concluded that vitamin D levels could be valuable in predicting severe forms of MIS-C and correction of abnormal levels in severe MIS-C may influences its evolution. 25-hydroxyvitamin D3 [25(OH)D3] supplementation raising serum [25(OH)D] concentrations potentially have a favorable effect in reducing the severity of MIS-C in certain circumstances. Further studies are needed to confirm these results.,Therapeutics,https://www.frontiersin.org/articles/10.3389/fimmu.2021.648546/full
2021-03-09-international-journal-of-environmental-research-and-public-health_ijerph18052772.md,2021-03-09,International Journal of Environmental Research and Public Health,Ansätze zum Ernährungsscreening bei Patienten mit Coronavirus-Erkrankungen 2019 (COVID-19),"Unterernährung ist bei schweren Patienten mit Coronavirus-Krankheit 2019 (COVID-19) häufig, vor allem bei älteren Erwachsenen und Patienten mit Begleiterkrankungen. Sie ist auch mit einer atypischen Präsentation der Krankheit verbunden. Trotz des möglichen Beitrags der Mangelernährung zum Erwerb und zur Schwere der COVID-19-Erkrankung ist nicht klar, mit welchen Ernährungsscreening-Maßnahmen eine Mangelernährung bei diesen Patienten am besten in einem frühen Stadium diagnostiziert werden kann. Dies ist angesichts der Dringlichkeit und des raschen Fortschreitens der Krankheit in gefährdeten Gruppen von entscheidender BedUeutung. Dementsprechend wird in dieser Übersichtsarbeit die verfügbare Literatur zu verschiedenen Ernährungsscreening-Ansätzen untersucht, die bei COVID-19-Patienten eingesetzt werden, wobei ein besonderer Schwerpunkt auf älteren Erwachsenen liegt. Nach einer Literaturrecherche wurden 14 Studien zur Bewertung der Mangelernährung bei COVID-19-Patienten ausgewählt und untersucht. Das Nutrition Risk Screening 2002 (NRS-2002) hat eine höhere Sensitivität als andere traditionelle Screening-Maßnahmen gezeigt. Der CONUT-Score (Controlling Nutritional Status), der sich aus dem Serumalbuminspiegel, dem Cholesterinspiegel und der Lymphozytenzahl zusammensetzt, sowie ein kombinierter CONUT-Laktatdehydrogenase-C-reaktives Protein-Score wiesen bei COVID-19-Patienten im mittleren und höheren Lebensalter eine noch bessere Vorhersagekraft auf als der NRS-2002 (0,81 % und 0,92 % gegenüber 0,79 %). Daher können einfache, auf routinemäßig durchgeführten Laboruntersuchungen basierende Maßnahmen wie der CONUT-Score eine zeitnahe, kostengünstige und wertvolle Alternative zur Identifizierung von COVID-19-Patienten mit hohem Ernährungsrisiko sein. Die Mini-Ernährungsanalyse (MNA) war die einzige Maßnahme, mit der eine Restunterernährung und ein hohes Unterernährungsrisiko bei remittierenden Patienten festgestellt werden konnte - der MNA-Score korrelierte mit Hypoalbuminämie, Hyperzytokinämie und Gewichtsverlust. Ältere Männer mit schweren Entzündungen, gastrointestinalen Symptomen und vorbestehenden Begleiterkrankungen (Diabetes, Adipositas oder Bluthochdruck) sind sowohl in der akuten Phase als auch in der Rekonvaleszenz anfälliger für eine Unterernährung und damit für eine schlechte COVID-19-Prognose. Sie benötigen daher eine häufige Ernährungsüberwachung und -unterstützung, während die Erkennung und Behandlung von Unterernährung in der Allgemeinbevölkerung notwendig sein könnte, um die Widerstandsfähigkeit gegen COVID-19 zu erhöhen.",Approaches to Nutritional Screening in Patients with Coronavirus Disease 2019 (COVID-19),"Malnutrition is common among severe patients with coronavirus disease 2019 (COVID-19), mainly elderly adults and patients with comorbidities. It is also associated with atypical presentation of the disease. Despite the possible contribution of malnutrition to the acquisition and severity of COVID-19, it is not clear which nutritional screening measures may best diagnose malnutrition in these patients at early stages. This is of crucial importance given the urgency and rapid progression of the disease in vulnerable groups. Accordingly, this review examines the available literature for different nutritional screening approaches implemented among COVID-19 patients, with a special focus on elderly adults. After a literature search, we selected and scrutinized 14 studies assessing malnutrition among COVID-19 patients. The Nutrition Risk Screening 2002 (NRS-2002) has demonstrated superior sensitivity to other traditional screening measures. The controlling nutritional status (CONUT) score, which comprises serum albumin level, cholesterol level, and lymphocytes count, as well as a combined CONUT-lactate dehydrogenase-C-reactive protein score expressed a predictive capacity even superior to that of NRS-2002 (0.81% and 0.92% vs. 0.79%) in midlife and elder COVID-19 patients. Therefore, simple measures based on routinely conducted laboratory investigations such as the CONUT score may be timely, cheap, and valuable alternatives for identifying COVID-19 patients with high nutritional risk. Mini Nutritional Assessment (MNA) was the only measure used to detect residual malnutrition and high malnutrition risk in remitting patients-MNA scores correlated with hypoalbuminemia, hypercytokinemia, and weight loss. Older males with severe inflammation, gastrointestinal symptoms, and pre-existing comorbidities (diabetes, obesity, or hypertension) are more prone to malnutrition and subsequently poor COVID-19 prognosis both during the acute phase and during convalescence. Thus, they are in need of frequent nutritional monitoring and support while detecting and treating malnutrition in the general public might be necessary to increase resilience against COVID-19.",Therapeutics,https://www.mdpi.com/1660-4601/18/5/2772/htm
2021-03-10-current-tropical-medicine-reports_s40475-021-00236-3.md,2021-03-10,Current Tropical Medicine Reports,Vitamin-D-Status: Kann er das Infektionsrisiko und den Schweregrad der COVID-19-Symptome beeinflussen?,"Inmitten der COVID-19-Pandemie sind mehrere wissenschaftliche Studien entstanden, die die Bedeutung von Vitamin D bei der Entwicklung der SARS-CoV2-Infektion untersuchen. Der Grund für dieses Interesse liegt in den nachgewiesenen Auswirkungen des Vitamin-D-Status auf andere akute Atemwegsinfektionen, wie z. B. die Grippe. Ziel dieses Artikels ist es, die Rolle und den Einfluss der Vitamin-D-Serumkonzentration auf die Prävalenz und den Schweregrad von COVID-19 zu bestimmen. Mehrere Beobachtungsstudien haben gezeigt, dass suboptimale Vitamin-D-Serumkonzentrationen das Risiko, an COVID-19 zu erkranken, deutlich erhöhen und zu einer schwereren Symptomatik führen können. Eine Studie deutet jedoch darauf hin, dass eine Vitamin-D-Supplementierung möglicherweise die Sterblichkeitsrate bei COVID-19-Patienten erhöhen könnte. Der Vitamin-D-Status könnte eine wichtige Rolle bei der Entstehung und dem Verlauf der SARS-CoV2-Infektion spielen. Weitere Studien sind erforderlich, um den Wahrheitsgehalt und das Ausmaß dieses Zusammenhangs vollständig zu verstehen.",Vitamin D Status: Can It Affect the Risk of Infection and the Severity of COVID-19 Symptoms?,"In the midst of the COVID-19 pandemic, several academic studies have emerged that explore the importance of vitamin D in the development of the SARS-CoV2 infection. The basis of this interest comes from the established effect vitamin D status has on other acute respiratory infections, such as influenza. This article aims to determine the role and effect of vitamin D serum concentration in the prevalence and severity of COVID-19. Several observational studies have demonstrated that suboptimal levels of vitamin D serum concentrations can significantly increase the risk of developing COVID-19 and lead to a more severe symptomatology. One study suggests, however, that supplementation of vitamin D could potentially increase the incidence of mortality in COVID-19 patients. Vitamin D status could have an influential role in the development and progression of SARS-CoV2 infection. Further studies are warranted to understand fully the veracity and the extent of this association.",Therapeutics,https://www.ncbi.nlm.nih.gov/pmc/articles/PMC8010782/
2021-03-10-nutrition-metabolism-and-cardiovascular-diseases_j.numecd.2020.12.001.md,2021-03-10,"Nutrition, Metabolism and Cardiovascular Diseases",Ernährung und die Covid-19-Pandemie: Drei Faktoren mit großem Einfluss auf die Gesundheit der Bevölkerung,"Im Zuge der COVID-19-Pandemie wurden auf Websites und in sozialen Medien zahlreiche Vorschläge für natürliche Substanzen und verschiedene Arten von Nahrungsergänzungsmitteln mit thaumaturgischen Eigenschaften zur Vorbeugung und/oder Bekämpfung der Coronavirus-Infektion gemacht. In der Tat gibt es keine klinischen Studien, die belegen, dass eine diätetische oder pharmakologische Ergänzung einer bestimmten Substanz die Wirksamkeit der Immunabwehr erhöht. Es gibt jedoch drei Ernährungsprobleme, die unter den derzeitigen Umständen besondere Aufmerksamkeit verdienen, nämlich Vitamin-D-Mangel, übermäßige Salzaufnahme und unangemessener Alkoholkonsum. Im Folgenden wird ein kurzer Überblick über den derzeitigen Wissensstand über die mögliche Rolle dieser Faktoren im Immunabwehrsystem und ihre potenziellen Auswirkungen auf die Modulation der Immunantwort auf die SARS-COV2-Infektion gegeben. Für alle diese Faktoren gibt es überzeugende Hinweise auf einen Einfluss auf die Struktur und Funktion der Immunabwehr. In Ermangelung eines RCT-Nachweises, dass eine erhöhte Zufuhr einer bestimmten Substanz Schutz gegen den neuen Feind bietet, ist eine besondere Aufmerksamkeit für die Korrektur dieser drei ernährungsbedingten Kritikpunkte zum Zeitpunkt der COVID-Pandemie sicherlich gerechtfertigt. Wir schlagen vor, dass die unangemessene Aufnahme von Salz und Alkohol und das Risiko eines unzureichenden Vitamin-D-Status Gegenstand eines Screenings sein sollten, insbesondere bei Personen mit einem hohen Sterblichkeitsrisiko durch eine SARS-COV-2-Infektion, wie z. B. ältere Menschen in Heimen und alle, die von prädisponierenden Bedingungen betroffen sind.",Nutrition and the Covid-19 pandemic: Three factors with high impact on community health,"In the course of the COVID-19 pandemic, multiple suggestions have been delivered through websites and social media referring to natural substances and various kinds of supplements with thaumaturgical properties in preventing and/or fighting the coronavirus infection. Indeed, there is no clinical trial evidence that a dietary or pharmacological supplementation of any particular substance will increase the effectiveness of the immune defences. There are however three nutritional issues that deserve special attention under the present circumstances, namely vitamin D deficiency, excess salt intake and inappropriate alcohol consumption. Here is a short review of the current knowledge about the possible role of these factors in the immunity defence system and their potential impact on the modulation of the immune response to SARS-COV2 infection. For all of these factors there is convincing evidence of an impact on the immune defence structure and function. In the absence of RCT demonstration that increased ingestion of any given substance may confer protection against the new enemy, special attention to correction of these three nutritional criticisms is certainly warranted at the time of COVID pandemic. We propose that the inappropriate intake of salt and alcohol and the risk of inadequate vitamin D status should be object of screening, in particular in subjects at high mortality risk from SARS-COV 2 infection, such as institutionalised elderly subjects and all those affected by predisposing conditions.",Therapeutics,https://www.nmcd-journal.com/article/S0939-4753(20)30509-3/fulltext
2021-03-13-diabetes-and-metabolic-syndrome-clinical-research-and-reviews.md,2021-03-13,Diabetes & Metabolic Syndrome Clinical Research & Reviews,Auswirkungen des Vitamin-D-Mangels auf die COVID-19-Infektion und -Mortalität in asiatischen Ländern,"COVID-19 ist eine Pandemie, von der weltweit über 100 Millionen Menschen betroffen sind und die fast 3 Millionen Todesfälle verursacht hat. Vitamin D ist ein bekannter Risikofaktor für COVID-19. Daher wollten wir den Zusammenhang zwischen der Prävalenz des Vitamin-D-Mangels und dem durchschnittlichen Vitamin-D-Spiegel mit der COVID-19-Infektion und der Sterblichkeit in Asien untersuchen, wobei wir andere Störfaktoren wie das Durchschnittsalter, Fettleibigkeit und Diabetes mit einbeziehen wollten. Die COVID-19-Infektionen und -Mortalität in den asiatischen Ländern wurden von der Worldometer-Website abgerufen. Informationen über die Prävalenz des Vitamin-D-Mangels und die durchschnittlichen Vitamin-D-Werte in den einzelnen asiatischen Ländern wurden durch eine Literatursuche in PubMed® und Google scholar ermittelt. Die Zusammenhänge zwischen COVID-19-Infektionen und Sterblichkeit mit der Prävalenz des Vitamin-D-Mangels und dem durchschnittlichen Vitamin-D-Spiegel wurden anhand von Korrelationskoeffizienten untersucht. Als prädiktive Analyse wurde eine multiple lineare Regression mit allen Störfaktoren durchgeführt. Diese ergab positive Korrelationen zwischen der Prävalenz des Vitamin-D-Mangels und den COVID-19-Infektionen und -Mortalitäten. Darüber hinaus verbesserten sich die Zusammenhänge für COVID-19-Infektionen und Sterblichkeit insbesondere nach der Kombination mit den Störfaktoren. Ebenso wies der mittlere Vitamin-D-Spiegel eine signifikante negative Korrelation mit COVID-19-Infektionen und -Mortalität auf, wenn er mit Störfaktoren kombiniert wurde. Die Prävalenz des Vitamin-D-Mangels ist signifikant positiv, der mittlere Vitamin-D-Spiegel hingegen signifikant negativ mit der Infektions- und Sterblichkeitsrate von COVID-19 in den asiatischen Ländern verbunden, wenn man alle Störfaktoren in die Vorhersage einbezieht.",Impact of the vitamin D deficiency on COVID-19 infection and mortality in Asian countries,"COVID-19 is a pandemic that has affected beyond 100 million and caused nearly 3 million deaths globally. Vitamin D is a known risk factor for COVID-19. Therefore, we aimed to investigate the association of prevalence of vitamin D deficiency and mean vitamin D level with COVID-19 infection and mortality in Asia, predicting with other confounding factors such as median age, obesity, and diabetes. COVID-19 infections and mortalities among the Asian countries were retrieved from the Worldometer website. Information on prevalence of vitamin D deficiency and mean vitamin D values in each Asian country was retrieved through literature searching on PubMed® and Google scholar. The associations between COVID-19 infections and mortalities with prevalence of vitamin D deficiency and mean vitamin D level were explored with correlation coefficients. As a predictive analysis, multiple linear regression was carried out with all confounders. Positive correlations were observed for prevalence of vitamin D deficiency with COVID-19 infections and mortalities. Moreover, the associations for the COVID-19 infections and mortalities improved, respectively, after predicting with confounding factors. Similarly, mean vitamin D level had a significant negative correlation with COVID-19 infections and mortalities when combining with confounders. Prevalence of vitamin D deficiency is significantly positively associated whereas the mean vitamin D level is significantly negatively associated with both infection and mortality rate of COVID-19 among Asian countries upon predicting with all confounders.",Therapeutics,https://www.sciencedirect.com/science/article/pii/S1871402121000746
