filename,date,publisher,title,beschreibung,title,description,group,credit
2021-06-09-taylor-francis_22221751.2021.1942230.md,2021-06-09,Taylor & Francis,Symptomatische SARS-CoV-2-Infektionen nach vollständiger BNT162b2-Impfung bei seropositiven Beschäftigten im Gesundheitswesen: eine Fallserie aus einer einzigen Einrichtung,"Wir berichten über 11 Fälle von SARS-CoV-2-Infektionen bei Beschäftigten im Gesundheitswesen, die naiv für COVID-19 und seropositiv nach der zweiten Dosis des BNT162b2-mRNA-Impfstoffs waren. Auf der Grundlage der freiwilligen Überwachung wurden sie positiv auf verschiedene Stämme von SARS-CoV-2 getestet, wie die Sequenzierung des Spike-Gens ergab. Fünf von ihnen berichteten über leichte Symptome. Angesichts des Risikos einer Einschleppung von SARS-CoV-2 durch asymptomatische Geimpfte legt diese Fallserie nahe, dass Screening-Programme für den Nasen-Rachen-Raum fortgesetzt werden müssen.",Symptomatic SARS-CoV-2 infections after full schedule BNT162b2 vaccination in seropositive healthcare workers: a case series from a single institution,"We report 11 cases of SARS-CoV-2 infection in healthcare workers (HCW) naïve for COVID-19 and seropositive after the second dose of the BNT162b2 mRNA vaccine. Based on voluntary-based surveillance, they tested positive for different strains of SARS-CoV-2, as Spike gene sequencing showed. Five of them reported mild symptoms. Given the risk for SARS-CoV-2 introduction from asymptomatic vaccinees, this case series suggests the need to continue nasopharyngeal screening programmes.",Vaccines,https://www.tandfonline.com/doi/full/10.1080/22221751.2021.1942230
2021-06-09-the-lancet_j.eclinm.2021.100941.md,2021-06-09,The Lancet,"Ein einfacher Algorithmus für die Heimtherapie zur Vermeidung von Krankenhausaufenthalten bei COVID-19-Patienten: Eine retrospektive, beobachtende Matched-Cohort-Studie",Wirksame Algorithmen für die häusliche Behandlung auf der Grundlage pathophysiologischer und pharmakologischer Überlegungen zur Beschleunigung der Genesung und zur Vermeidung von Krankenhausaufenthalten bei Patienten mit früher Coronavirus-Erkrankung 2019 (COVID-19) hätten erhebliche Auswirkungen auf die Patienten und das Gesundheitssystem.,"A simple, home-therapy algorithm to prevent hospitalisation for COVID-19 patients: A retrospective observational matched-cohort study",Effective home treatment algorithms implemented based on a pathophysiologic and pharmacologic rationale to accelerate recovery and prevent hospitalisation of patients with early coronavirus disease 2019 (COVID-19) would have major implications for patients and health system.,Therapeutics,https://www.thelancet.com/journals/eclinm/article/PIIS2589-5370(21)00221-2/fulltext
2021-06-11-international-journal-of-molecular-sciences_ijms22126278.md,2021-06-11,International Journal of Molecular Sciences,Bewegung als positiver Modulator des Alterns,"Die Alterung der Menschen ist eine unbestreitbare Tatsache auch in Europa. Die Herausforderung für die Zukunft besteht nicht einfach darin, das menschliche Leben um jeden Preis und mit allen Mitteln zu verlängern, sondern vielmehr darin, die Selbstversorgung und die Lebensqualität zu erhöhen. Selbst in den fortschrittlichsten Gesellschaften bleiben die ewigen Fragen bestehen. Wer wird sich um die älteren Generationen kümmern? Werden die eigenen Lebensumstände der erwachsenen Kinder ausreichen, um die Familienmitglieder im Alter zu unterstützen? Aus einer Reihe komplexer Gründe, einschließlich sozioökonomischer Bedingungen, sind erwachsene Kinder oft nicht in der Lage oder nicht bereit, die Verantwortung für die Pflege älterer Familienmitglieder zu übernehmen. Aus diesem Grund ist es unerlässlich, dass alternde Erwachsene ihre Unabhängigkeit und Selbstversorgung so lange wie möglich aufrechterhalten. Bewegung ist ein wichtiger Bestandteil der Selbstversorgung. Außerdem hat sich gezeigt, dass Bewegung den klinischen Zustand der Patienten verbessert. In einer Zeit, in der die Coronavirus-Pandemie die Welt erschüttert, gehören ältere Menschen zu den am meisten gefährdeten. Unser Beitrag untersucht den aktuellen Wissensstand und bietet Einblicke in die bedeutenden Vorteile von Bewegung für ältere Menschen, einschließlich einer verbesserten Immunität. Wir erörtern die biochemischen Prozesse des Alterns und die entgegenwirkenden Effekte von Bewegung und körpereigenen Substanzen wie Vitamin D.",Movement as a Positive Modulator of Aging,"The aging of human populations, including those in Europe, is an indisputable fact. The challenge for the future is not simply prolonging human life at any cost or by any means but rather extending self-sufficiency and quality of life. Even in the most advanced societies, the eternal questions remain. Who will take care of the older generations? Will adult children’s own circumstances be sufficient to support family members as they age? For a range of complex reasons, including socioeconomic conditions, adult children are often unable or unwilling to assume responsibility for the care of older family members. For this reason, it is imperative that aging adults maintain their independence and self-care for as long as possible. Movement is an important part of self-sufficiency. Moreover, movement has been shown to improve patients’ clinical status. At a time when the coronavirus pandemic is disrupting the world, older people are among the most vulnerable. Our paper explores current knowledge and offers insights into the significant benefits of movement for the elderly, including improved immunity. We discuss the biochemical processes of aging and the counteractive effects of exercise and endogenous substances, such as vitamin D.",Therapeutics,https://www.mdpi.com/1422-0067/22/12/6278/htm
2021-06-12-journal-of-endocrinological-investigation_s40618-021-01614-4.md,2021-06-12,Journal of Endocrinological Investigation,Vitamin-D-Supplementierung und klinische Ergebnisse bei COVID-19: eine systematische Überprüfung und Meta-Analyse,"Eine genaue Zusammenfassung und Zusammenstellung der bisher verfügbaren klinischen Nachweise über die Wirkung einer Vitamin-D-Supplementierung auf die klinischen Ergebnisse bei COVID-19-Patienten. Die Datenbanken PubMed/MEDLINE, Scopus und Web of Science wurden bis zum 8. Juni 2021 systematisch unter Verwendung geeigneter Schlüsselwörter durchsucht, um Beobachtungsstudien und randomisierte kontrollierte Studien (RCTs) zu identifizieren, die über negative klinische Ergebnisse (Intensivstation und/oder Sterblichkeit) bei COVID-19-Patienten berichten, die eine Vitamin-D-Supplementierung erhalten haben, im Vergleich zu denen, die diese nicht erhalten haben. Berücksichtigt wurden sowohl die vorherige Einnahme als auch die Einnahme von Vitamin D nach der COVID-19-Diagnose. Es wurden unbereinigte/bereinigte gepoolte Odds Ratio (OR) mit 95% Konfidenzintervallen (CI) berechnet (PROSPERO-Registrierungsnummer CRD42021248488). Wir identifizierten 13 Studien (10 Beobachtungsstudien, 3 RCTs), in denen Daten von 2933 COVID-19-Patienten zusammengefasst wurden. Die gepoolte Analyse der unbereinigten Daten zeigte, dass die Einnahme von Vitamin D in der COVID-19-Studie signifikant mit einer geringeren Zahl von Krankenhauseinweisungen oder einer geringeren Sterblichkeit auf der Intensivstation verbunden war. Auch bei der Zusammenführung der bereinigten Risikoschätzungen wurde festgestellt, dass Vitamin D das Risiko nachteiliger Folgen verringert. Eine Untergruppenanalyse zeigte, dass eine Vitamin-D-Supplementierung nur bei den Patienten, die das Medikament nach der COVID-19-Diagnose erhielten, mit besseren klinischen Ergebnissen verbunden war, nicht aber bei denjenigen, die bereits vor der Diagnose Vitamin D erhalten hatten. Eine Vitamin-D-Supplementierung könnte mit einer Verbesserung der klinischen Ergebnisse verbunden sein, insbesondere wenn sie nach der Diagnose von COVID-19 verabreicht wird. Fragen zur angemessenen Dosis, Dauer und Art der Verabreichung von Vitamin D sind jedoch noch unbeantwortet und bedürfen weiterer Forschung.",Vitamin D supplementation and clinical outcomes in COVID-19: a systematic review and meta-analysis,"To provide a precise summary and collate the hitherto available clinical evidence on the effect of vitamin D supplementation on clinical outcomes in COVID-19 patients. PubMed/MEDLINE, Scopus, and Web of Science databases were systematically searched using appropriate keywords till June 8, 2021, to identify observational studies and randomized controlled trials (RCTs) reporting adverse clinical outcomes (ICU admission and/or mortality) in COVID-19 patients receiving vitamin D supplementation vs. those not receiving the same. Both prior use and use of vitamin D after COVID-19 diagnosis were considered. Unadjusted/adjusted pooled odds ratio (OR) with 95% confidence intervals (CI) were calculated (PROSPERO registration number CRD42021248488). We identified 13 studies (10 observational, 3 RCTs) pooling data retrieved from 2933 COVID-19 patients. Pooled analysis of unadjusted data showed that vitamin D use in COVID-19 was significantly associated with reduced ICU admission/mortality. Similarly, on pooling adjusted risk estimates, vitamin D was also found to reduce the risk of adverse outcomes. Subgroup analysis showed that vitamin D supplementation was associated with improved clinical outcomes only in patients receiving the drug post-COVID-19 diagnosis and not in those who had received vitamin D before diagnosis. Vitamin D supplementation might be associated with improved clinical outcomes, especially when administered after the diagnosis of COVID-19. However, issues regarding the appropriate dose, duration, and mode of administration of vitamin D remain unanswered and need further research.",Therapeutics,https://www.ncbi.nlm.nih.gov/pmc/articles/PMC8223190/
2021-06-13-nutrition-research_j.nutres.2021.05.008.md,2021-06-13,Nutrition Research,Mögliche molekulare Mechanismen der Zink- und Kupfer-vermittelten antiviralen Aktivität auf COVID-19,"Die neuartige Coronavirus-Krankheit 2019 (COVID-19) hat sich weltweit ausgebreitet, und überraschenderweise gibt es keine potenziell schützenden oder therapeutischen antiviralen Moleküle zur Behandlung der Infektion mit dem schweren akuten respiratorischen Syndrom Coronavirus-2 (SARS-CoV-2). Jedoch hat sich gezeigt, dass Zink (Zn) und Kupfer (Cu) aufgrund ihrer antioxidativen, entzündungshemmenden und antiviralen Eigenschaften eine schützende Wirkung ausüben. Daher stellen wir die Hypothese auf, dass eine Supplementierung mit Zn und Cu allein oder als Adjuvans eine vielversprechende Wirksamkeit und ein günstiges Sicherheitsprofil aufweisen könnte, um die Symptome zu lindern und das Fortschreiten der schweren Form der SARS-CoV-2-Infektion aufzuhalten. Ziel dieser Übersichtsarbeit ist, die vorgeschlagenen zugrunde liegenden molekularen Mechanismen und ihre Auswirkungen auf die Bekämpfung der SARS-CoV-2-Infektion als Reaktion auf die Verabreichung von Zn und Cu zu diskutieren. In mehreren klinischen Studien wurde auch die Verwendung von Zn als adjuvante Therapie mit diätetischen Maßnahmen/antiviralen Medikamenten gegen COVID-19-Infektionen untersucht. Insgesamt fasst diese Übersicht zusammen, dass eine Ernährungsintervention mit Zn und Cu eine alternative Behandlungsstrategie darstellen könnte, indem sie ihre viruziden Wirkungen über mehrere grundlegende molekulare Kaskaden auslöst, wie z. B. die Modulation von Immunantworten, Redox-Signalen, Autophagie und die Behinderung des viralen Eintritts und der Genomreplikation während der SARS-CoV-2-Infektion.",Potential molecular mechanisms of zinc- and copper-mediated antiviral activity on COVID-19,"Novel coronavirus disease 2019 (COVID-19) has spread across the globe; and surprisingly, no potentially protective or therapeutic antiviral molecules are available to treat severe acute respiratory syndrome coronavirus-2 (SARS-CoV-2) infection. However, zinc (Zn) and copper (Cu) have been shown to exert protective effects due to their antioxidant, anti-inflammatory, and antiviral properties. Therefore, it is hypothesized that supplementation with Zn and Cu alone or as an adjuvant may be beneficial with promising efficacy and a favorable safety profile to mitigate symptoms, as well as halt progression of the severe form of SARS-CoV-2 infection. The objective of this review is to discuss the proposed underlying molecular mechanisms and their implications for combating SARS-CoV-2 infection in response to Zn and Cu administration. Several clinical trials have also included the use of Zn as an adjuvant therapy with dietary regimens/antiviral drugs against COVID-19 infection. Overall, this review summarizes that nutritional intervention with Zn and Cu may offer an alternative treatment strategy by eliciting their virucidal effects through several fundamental molecular cascades, such as, modulation of immune responses, redox signaling, autophagy, and obstruction of viral entry and genome replication during SARS-CoV-2 infection.",Therapeutics,https://www.sciencedirect.com/science/article/pii/S0271531721000300
2021-06-16-clinical-medicine-journal_clinmed.2021-0035.md,2021-02-16,Clinical Medicine Journal,"Vitamin-D-Supplementierung beugt Rachitis und akuten Atemwegsinfektionen vor, wenn sie als tägliche Erhaltungsdosis, nicht aber als intermittierender Bolus verabreicht wird: Auswirkungen auf COVID-19","Der Wert einer Vitamin-D-Supplementierung bei der Behandlung oder Vorbeugung verschiedener Erkrankungen wird aufgrund widersprüchlicher Ergebnisse randomisierter Studien oft mit Skepsis betrachtet. Jetzt zeigt sich, dass es ein Muster für diese Widersprüche gibt. Eine kürzlich durchgeführte große Studie hat gezeigt, dass eine hochdosierte intermittierende Bolus-Vitamin-D-Therapie zur Vorbeugung von Rachitis - der Erkrankung, die am eindeutigsten durch Vitamin-D-Mangel verursacht wird - unwirksam ist. Dafür gibt es eine plausible biologische Erklärung, da eine hochdosierte Bolus-Substitution die langfristige Expression des katabolischen Enzyms 24-Hydroxylase und des Fibroblasten-Wachstumsfaktors 23 induziert, die beide eine Vitamin-D-inaktivierende Wirkung haben. Metaanalysen zur Vitamin-D-Supplementierung bei der Vorbeugung akuter Atemwegsinfektionen und Studien zu Tuberkulose und anderen Erkrankungen sprechen ebenfalls für die Wirksamkeit einer niedrigen täglichen Erhaltungsdosis anstelle einer intermittierenden Bolusgabe. Dies ist angesichts der aktuellen COVID-19-Pandemie besonders wichtig, da ein Zusammenhang zwischen COVID-19-Risiko und Vitamin-D-Mangel gut dokumentiert ist. Wir möchten die Kliniker auffordern, diese Ergebnisse zur Kenntnis zu nehmen und eine weit verbreitete tägliche Vitamin-D-Supplementierung nachdrücklich zu unterstützen.",Perspective: Vitamin D supplementation prevents rickets and acute respiratory infections when given as daily maintenance but not as intermittent bolus: implications for COVID-19,"The value of vitamin D supplementation in the treatment or prevention of various conditions is often viewed with scepticism as a result of contradictory results of randomised trials. It is now becoming apparent that there is a pattern to these inconsistencies. A recent large trial has shown that high-dose intermittent bolus vitamin D therapy is ineffective at preventing rickets – the condition that is most unequivocally caused by vitamin D deficiency. There is a plausible biological explanation since high-dose bolus replacement induces long-term expression of the catabolic enzyme 24-hydroxylase and fibroblast growth factor 23, both of which have vitamin D inactivating effects. Meta-analyses of vitamin D supplementation in prevention of acute respiratory infection and trials in tuberculosis and other conditions also support efficacy of low dose daily maintenance rather than intermittent bolus dosing. This is particularly relevant during the current COVID-19 pandemic given the well-documented associations between COVID-19 risk and vitamin D deficiency. We would urge that clinicians take note of these findings and give strong support to widespread use of daily vitamin D supplementation.",Therapeutics,https://www.rcpjournals.org/content/clinmedicine/21/2/e144
2021-06-17-IntJLabHematol_ijlh.13629.md,2021-06-17,International Journal of Laboratory Hematology,Labortests bei Verdacht auf COVID-19-Impfstoff-induzierte (immunologische) thrombotische Thrombozytopenie,"Zusammenfassung: COVID-19 (Coronavirus-Krankheit 2019) stellt eine Pandemie dar, und es wurden mehrere Impfstoffe hergestellt, um eine Infektion und/oder schwere Folgeerscheinungen im Zusammenhang mit einer SARS-CoV-2-Infektion (schweres akutes respiratorisches Syndrom - Coronavirus 2) zu verhindern. Es gibt mehrere Berichte über seltene thrombotische Ereignisse nach der Impfung, insbesondere bei Impfstoffen auf Adenovirenbasis. Diese wurden als VIPIT (vaccine-induced prothrombotic immune thrombocytopenia), VITT (vaccine-induced [immune] thrombotic thrombocytopenia), VATT (vaccine-associated [immune] thrombotic thrombocytopenia) und TTS (thrombosis with thrombocytopenia syndrome) bezeichnet. In diesem Bericht werden die Labortestverfahren, die zur Beurteilung des Verdachts auf VITT eingesetzt werden, überprüft. In den bisher veröffentlichten Berichten gibt es bemerkenswerte Ähnlichkeiten und Unterschiede in den Testverfahren, die möglicherweise zur Identifizierung leicht unterschiedlicher Patientenkohorten führen. Der Schlüssel zu einer angemessenen Identifizierung/Ausschluss von VITT und einer möglichen Unterscheidung von Heparin-induzierter Thrombozytopenie mit Thrombose (HITT) ist die Identifizierung potenziell unterschiedlicher Testmuster. Zusammenfassend lässt sich sagen, dass die Tests in der Regel die Thrombozytenzahl, D-Dimer, Fibrinogen und verschiedene immunologische und funktionelle Tests für Thrombozytenfaktor-4-Antikörper (PF4) umfassen. Bei Verdacht auf VITT besteht in der Regel ein stark erhöhter D-Dimer-Spiegel, eine Thrombozytopenie, und PF4-Antikörper können mit ELISA-basierten Tests nachgewiesen werden, nicht jedoch mit anderen immunologischen Tests, die typischerweise bei HITT positiv sind. Darüber hinaus wurde in einigen Tests zur funktionellen Thrombozytenaktivierung festgestellt, dass Standardheparindosen die Aktivierung bei Verdacht auf VITT hemmen, während sie bei HITT eher die Aktivierung verstärken. Umgekehrt ist es auch wichtig, VITT nicht übermäßig zu diagnostizieren, da nicht alle Fälle von Thrombose nach einer Impfung eine immunologische Grundlage haben und nicht alle PF4-ELISA-positiven Patienten VITT sind. Schlüsselwörter: COVID-19; Labortests; Thrombozyten-Faktor-4-Antikörper; Thrombose mit Thrombozytopenie-Syndrom; impfstoffassoziierte thrombotische Thrombozytopenie; impfstoffinduzierte (immunbedingte) thrombotische Thrombozytopenie.",Laboratory testing for suspected COVID-19 vaccine-induced (immune) thrombotic thrombocytopenia,"Abstract: COVID-19 (coronavirus disease 2019) represents a pandemic, and several vaccines have been produced to prevent infection and/or severe sequelae associated with SARS-CoV-2 (severe acute respiratory syndrome coronavirus 2) infection. There have been several reports of infrequent post vaccine associated thrombotic events, in particular for adenovirus-based vaccines. These have variously been termed VIPIT (vaccine-induced prothrombotic immune thrombocytopenia), VITT (vaccine-induced [immune] thrombotic thrombocytopenia), VATT (vaccine-associated [immune] thrombotic thrombocytopenia), and TTS (thrombosis with thrombocytopenia syndrome). In this report, the laboratory test processes, as utilised to assess suspected VITT, are reviewed. In published reports to date, there are notable similarities and divergences in testing approaches, potentially leading to identification of slightly disparate patient cohorts. The key to appropriate identification/exclusion of VITT, and potential differentiation from heparin-induced thrombocytopenia with thrombosis (HITT), is identification of potentially differential test patterns. In summary, testing typically comprises platelet counts, D-dimer, fibrinogen, and various immunological and functional assays for platelet factor 4 (PF4) antibodies. In suspected VITT, there is a generally highly elevated level of D-dimer, thrombocytopenia, and PF4 antibodies can be identified by ELISA-based assays, but not by other immunological assays typically positive in HITT. In addition, in some functional platelet activation assays, standard doses of heparin have been identified to inhibit activation in suspected VITT, but they tend to augment activation in HITT. Conversely, it is also important to not over-diagnose VITT, given that not all cases of thrombosis post vaccination will have an immune basis and not all PF4-ELISA positive patients will be VITT. Keywords: COVID-19; laboratory testing; platelet factor 4 antibodies; thrombosis with thrombocytopenia syndrome; vaccine-associated thrombotic thrombocytopenia; vaccine-induced (immune) thrombotic thrombocytopenia.",Vaccines,https://onlinelibrary.wiley.com/doi/10.1111/ijlh.13629
2021-06-18-MetabolismOpen_j.metop.2021.100101.md,2021-06-18,Metabolism Open,Impfstoffinduzierte thrombotische Thrombozytopenie: Das düstere Kapitel einer Erfolgsgeschichte.,"Das Bekanntwerden der seltenen, aber schwerwiegenden und potenziell tödlichen Komplikation der impfstoffinduzierten thrombotischen Thrombozytopenie (VITT) gab Anlass zu Bedenken hinsichtlich der Sicherheit von COVID-19-Impfstoffen und führte in vielen Ländern zu einem Überdenken der Impfstrategien. Nach der Beschreibung von VITT bei Empfängern des adenoviralen Vektorimpfstoffs ChAdOx1 gab eine Überprüfung ähnlicher Fälle nach der Impfung mit Ad26.COV2-S Anlass zu der Frage, ob diese Entität eine potenzielle Klassenwirkung aller adenoviralen Vektorimpfstoffe darstellen könnte. Bei den meisten Fällen handelt es sich um Frauen, die in der Regel jünger als 60 Jahre sind und kurz (5-30 Tage) nach der Impfung eine Thrombozytopenie und thrombotische Manifestationen, gelegentlich an mehreren Stellen, aufweisen. Nach anfänglicher Unsicherheit wurden konkrete Empfehlungen für die Diagnose (klinischer Verdacht, erstes Laborscreening, PF4-Polyanion-Antikörper-ELISA) und die Behandlung der VITT (Nicht-Heparin-Antikoagulanzien, Kortikosteroide, intravenöses Immunglobulin) herausgegeben. Die Mechanismen, die diesem seltenen Syndrom zugrunde liegen, sind derzeit Gegenstand aktiver Forschung und umfassen Folgendes: 1) Produktion von PF4-Polyanion-Autoantikörpern; 2) Eintritt des adenoviralen Vektors in Megakaryozyten und anschließende Expression des Spike-Proteins auf der Thrombozytenoberfläche; 3) direkte Bindung und Aktivierung von Thrombozyten und Endothelzellen durch den adenoviralen Vektor; 4) Aktivierung von Endothel- und Entzündungszellen durch die PF4-Polyanion-Autoantikörper; 5) Vorhandensein eines entzündlichen Co-Signals; und 6) die Häufigkeit von zirkulierenden löslichen Spike-Protein-Varianten nach der Impfung. Neben der Analyse möglicher zugrunde liegender Mechanismen zielt diese Übersichtsarbeit darauf ab, die klinischen und epidemiologischen Merkmale der VITT zusammenzufassen, die aktuellen evidenzbasierten Empfehlungen zur diagnostischen und therapeutischen Abklärung der VITT vorzustellen und neue Dilemmata und Perspektiven zu diskutieren, die nach der Beschreibung dieser Entität entstanden sind. Schlüsselwörter: Adenoviraler Vektor; Adenovirus; COVID-19; SARS-CoV-2; Impfstoff-induzierte thrombotische Thrombozytopenie; Impfstoff",Vaccine induced thrombotic thrombocytopenia: The shady chapter of a success story.,"The recognition of the rare but serious and potentially lethal complication of vaccine induced thrombotic thrombocytopenia (VITT) raised concerns regarding the safety of COVID-19 vaccines and led to the reconsideration of vaccination strategies in many countries. Following the description of VITT among recipients of adenoviral vector ChAdOx1 vaccine, a review of similar cases after Ad26.COV2·S vaccination gave rise to the question whether this entity may constitute a potential class effect of all adenoviral vector vaccines. Most cases are females, typically younger than 60 years who present shortly (range: 5–30 days) following vaccination with thrombocytopenia and thrombotic manifestations, occasionally in multiple sites. Following initial incertitude, concrete recommendations to guide the diagnosis (clinical suspicion, initial laboratory screening, PF4-polyanion-antibody ELISA) and management of VITT (non-heparin anticoagulants, corticosteroids, intravenous immunoglobulin) have been issued. The mechanisms behind this rare syndrome are currently a subject of active research and include the following: 1) production of PF4-polyanion autoantibodies; 2) adenoviral vector entry in megacaryocytes and subsequent expression of spike protein on platelet surface; 3) direct platelet and endothelial cell binding and activation by the adenoviral vector; 4) activation of endothelial and inflammatory cells by the PF4-polyanion autoantibodies; 5) the presence of an inflammatory co-signal; and 6) the abundance of circulating soluble spike protein variants following vaccination. Apart from the analysis of potential underlying mechanisms, this review aims to synopsize the clinical and epidemiologic features of VITT, to present the current evidence-based recommendations on diagnostic and therapeutic work-up of VITT and to discuss new dilemmas and perspectives that emerged after the description of this entity. Keywords: Adenoviral vector; Adenovirus; COVID-19; SARS-CoV-2; Vaccine induced thrombotic thrombocytopenia; Vaccine",Vaccines,https://www.sciencedirect.com/science/article/pii/S2589936821000256
