filename,date,publisher,title,beschreibung,title,description,group,credit
2012-11-05-inflammation-research_s00011-021-01510-w.md,2021-11-05,Inflammation Research,"Interaktionen zwischen Darmmikrobiom, Vitamin D und ACE2 sind kritische Faktoren bei der Immunseneszenz und Entzündung: Schlüssel für die Impfstoffreaktion und den Schweregrad der COVID-19-Infektion","Die SARS-CoV-2-Pandemie breitet sich weiterhin sporadisch in den Vereinigten Staaten und weltweit aus.  Schweregrad und Sterblichkeit betrafen vor allem gebrechliche ältere Menschen mit Vorerkrankungen. Hinweise mehren sich, dass die Wechselwirkungen zwischen dem Darmmikrobiom, Vitamin D und dem RAS/ACE2-System für ein ausgewogenes Funktionieren des Immunsystems älterer Menschen und für die Regulierung von Entzündungen von wesentlicher Bedeutung sind. In dieser Übersichtsarbeit stellen wir die Hypothese auf, dass der Zustand des Darmmikrobioms vor der Infektion den Ausgang der COVID-19-Sepsis bestimmt und auch ein kritischer Faktor für den Impferfolg sein könnte. Artikel aus PubMed/Medline-Recherchen wurden mit einer Kombination der Begriffe ""SARS-CoV-2, COVID-19, Entzündung, Immun-Seneszenz, Darmmikrobiom, Vitamin D, RAS/ACE2, Impfung"" überprüft. Hinweise auf einen komplexen Zusammenhang zwischen dem Darmmikrobiom, der ACE-2-Expression und Vitamin D beim Schweregrad von COVID-19 existieren. Der Status des Darmmikrobioms ist in hohem Maße prädiktiv für die molekularen Signaturen und Entzündungsmarker im Blut sowie für die Reaktionen des Wirts auf Infektionen. Vitamin D hat eine immunmodulatorische Funktion bei der angeborenen und adaptiven Immunantwort auf virale Infektionen. Zu den entzündungshemmenden Funktionen von Vitamin D gehören die Regulierung des Darmmikrobioms und die Erhaltung der mikrobiellen Vielfalt. Es fördert das Wachstum darmfreundlicher kommensaler Stämme von Bifida- und Fermicutus-Arten. Darüber hinaus ist Vitamin D ein negativer Regulator für die Expression von Renin und interagiert mit der RAS/ACE/ACE-2-Signalachse. Zusammengenommen könnte dieser Dreiklang das entscheidende Bindeglied bei der Bestimmung des Ausgangs einer SARS-CoV-2-Infektion sein. Die vorgestellten Daten sind empirisch und informativ. Weitere Forschungen unter Verwendung fortschrittlicher systembiologischer Techniken und einer durch künstliche Intelligenz unterstützten Integration könnten dazu beitragen, das Darmmikrobiom mit Sepsis und Impfstoffreaktionen in Beziehung zu setzen. Die Modulation dieser Faktoren könnte den Erfolg von Impfstoffen und klinischen Ergebnissen bei COVID-19-Infektionen beeinflussen.","Gut microbiome, Vitamin D, ACE2 interactions are critical factors in immune-senescence and inflammaging: key for vaccine response and severity of COVID-19 infection","The SARS-CoV-2 pandemic continues to spread sporadically in the Unites States and worldwide. The severity and mortality excessively affected the frail elderly with co-existing medical diseases. There is growing evidence that cross-talk between the gut microbiome, Vitamin D and RAS/ACE2 system is essential for a balanced functioning of the elderly immune system and in regulating inflammation. In this review, we hypothesize that the state of gut microbiome, prior to infection determines the outcome associated with COVID-19 sepsis and may also be a critical factor in success to vaccination. Articles from PubMed/Medline searches were reviewed using a combination of terms ""SARS-CoV-2, COVID-19, Inflammaging, Immune-senescence, Gut microbiome, Vitamin D, RAS/ACE2, Vaccination"". Evidence indicates a complex association between gut microbiota, ACE-2 expression and Vitamin D in COVID-19 severity. Status of gut microbiome is highly predictive of the blood molecular signatures and inflammatory markers and host responses to infection. Vitamin D has immunomodulatory function in innate and adaptive immune responses to viral infection. Anti-inflammatory functions of Vit D include regulation of gut microbiome and maintaining microbial diversity. It promotes growth of gut-friendly commensal strains of Bifida and Fermicutus species. In addition, Vitamin D is a negative regulator for expression of renin and interacts with the RAS/ ACE/ACE-2 signaling axis. Collectively, this triad may be the critical, link in determination of outcomes in SARS-CoV-2 infection. The presented data are empirical and informative. Further research using advanced systems biology techniques and artificial intelligence-assisted integration could assist with correlation of the gut microbiome with sepsis and vaccine responses. Modulating these factors may impact in guiding the success of vaccines and clinical outcomes in COVID-19 infections.",Therapeutics,https://www.ncbi.nlm.nih.gov/pmc/articles/PMC8568567/
2017-08-01-biochimie_j.biochi.2017.07.016.md,2017-08-01,Biochimie,TMPRSS2: Ein potenzielles Ziel für die Behandlung von Infektionen mit Influenza- und Coronaviren,"Zu Beginn des 21. Jahrhunderts sind weltweit immer wieder Influenza- und Coronavirus-Epidemien oder -Pandemien aufgetreten. Diese Epidemien oder Pandemien stellen eine große Bedrohung für die menschliche Gesundheit dar. Hier wird die kritische Rolle der Wirtszellprotease TMPRSS2 bei Infektionen mit Influenzaviren und Coronaviren beschrieben und eine antivirale therapeutische Strategie vorgestellt, die auf TMPRSS2 abzielt.",TMPRSS2: A potential target for treatment of influenza virus and coronavirus infections,"Influenza virus and coronavirus epidemics or pandemics have occurred in succession worldwide throughout the early 21st century. These epidemics or pandemics pose a major threat to human health. Here, we outline a critical role of the host cell protease TMPRSS2 in influenza virus and coronavirus infections and highlight an antiviral therapeutic strategy targeting TMPRSS2.",Therapeutics,https://www.ncbi.nlm.nih.gov/pmc/articles/PMC7116903/
2020-04-16-diabetes-and-metabolic-syndrome_j.dsx.2020.04.015.md,2020-04-16,Diabetes & Metabolic Syndrome,"Stärkung der Immunität bei Virusinfektionen, mit besonderer Berücksichtigung von COVID-19: Ein Überblick","Eine ausgewogene Ernährung, die zur Aufrechterhaltung der Immunität beitragen kann, ist für die Prävention und Behandlung von Virusinfektionen von wesentlicher Bedeutung. Da keine Daten zur Ernährung bei Coronavirus-Infektionen (COVID-19) vorliegen, haben wir in dieser Übersichtsarbeit die Erkenntnisse aus früheren klinischen Studien ausgewertet, in denen ernährungsbasierte Interventionen bei Viruserkrankungen (mit besonderem Schwerpunkt auf Atemwegsinfektionen) untersucht wurden, und unsere Beobachtungen zusammengefasst. Mit Hilfe einer systematischen Suchstrategie und unter Verwendung von Schlüsselwörtern wurde die Literatur in 3 wichtigen medizinischen Datenbanken durchsucht: PubMed®, Web of Science® und SciVerse Scopus®. Als geeignet galten Studien, bei denen es sich um kontrollierte Studien am Menschen handelte, in denen immunologische Parameter zu Virus- und Atemwegsinfektionen gemessen wurden. Klinische Studien zu Vitaminen, Mineralien, Nahrungsergänzungsmitteln und Probiotika wurden einbezogen. Insgesamt wurden zunächst 640 Datensätze ermittelt und 22 Studien aus anderen Quellen einbezogen. Nach Ausschluss von Duplikaten und Artikeln, die die Einschlusskriterien nicht erfüllten, wurden 43 Studien gefunden (Vitamine: 13; Mineralstoffe: 8; Nutrazeutika: 18 und Probiotika: 4). Bei den Vitaminen zeigten A und D einen potenziellen Nutzen, insbesondere bei Bevölkerungsgruppen mit einem Mangel. Bei den Spurenelementen haben Selen und Zink ebenfalls günstige immunmodulatorische Wirkungen bei viralen Atemwegsinfektionen gezeigt. Mehrere Nutrazeutika und Probiotika könnten ebenfalls eine gewisse Rolle bei der Stärkung der Immunfunktionen spielen. Mikronährstoffe können bei älteren Menschen, die an Nährstoffmangel leiden, von Vorteil sein. Wir fassen den möglichen Nutzen einiger Vitamine, Spurenelemente, Nutrazeutika und Probiotika bei Virusinfektionen zusammen. Auf diesen Daten basierende Ernährungsprinzipien könnten bei der Prävention und Behandlung von COVID-19 nützlich sein.","Enhancing immunity in viral infections, with special emphasis on COVID-19: A review","Balanced nutrition which can help in maintaining immunity is essential for prevention and management of viral infections. While data regarding nutrition in coronavirus infection (COVID-19) are not available, in this review, we aimed to evaluate evidence from previous clinical trials that studied nutrition-based interventions for viral diseases (with special emphasis on respiratory infections), and summarise our observations. A systematic search strategy was employed using keywords to search the literature in 3 key medical databases: PubMed®, Web of Science® and SciVerse Scopus®. Studies were considered eligible if they were controlled trials in humans, measuring immunological parameters, on viral and respiratory infections. Clinical trials on vitamins, minerals, nutraceuticals and probiotics were included. A total of 640 records were identified initially and 22 studies were included from other sources. After excluding duplicates and articles that did not meet the inclusion criteria, 43 studies were obtained (vitamins: 13; minerals: 8; nutraceuticals: 18 and probiotics: 4). Among vitamins, A and D showed a potential benefit, especially in deficient populations. Among trace elements, selenium and zinc have also shown favourable immune-modulatory effects in viral respiratory infections. Several nutraceuticals and probiotics may also have some role in enhancing immune functions. Micronutrients may be beneficial in nutritionally depleted elderly population. We summaries possible benefits of some vitamins, trace elements, nutraceuticals and probiotics in viral infections. Nutrition principles based on these data could be useful in possible prevention and management of COVID-19.",Therapeutics,https://www.sciencedirect.com/science/article/pii/S1871402120300801
2020-06-06-international-journal-of-infectious-diseases_j.ijid.2020.06.006.md,2020-06-06,International Journal of Infectious Diseases,Behandlung von SARS-CoV-2 mit hochdosierten oralen Zinksalzen: Ein Bericht über vier Patienten,"Das Coronavirus 2019 (COVID-19) ist eine Pandemie mit hoher Sterblichkeit und ohne anerkannte Therapie. Wir berichten hier über vier aufeinanderfolgende ambulante Patienten mit klinischen Merkmalen (CDC-Falldefinition) von und/oder laborbestätigten COVID-19, die mit hochdosierten Zinksalz-Lutschtabletten behandelt wurden. Bei allen vier Patienten kam es nach einem Tag hochdosierter Therapie zu einer signifikanten Verbesserung der objektiven und symptomatischen Krankheitsmaße, was darauf schließen lässt, dass die Zinktherapie eine Rolle bei der klinischen Genesung spielt. Es wird ein Mechanismus für die Wirkung von Zink vorgeschlagen, der auf zuvor veröffentlichten Studien zu SARS-CoV-1 und randomisierten kontrollierten Studien zur Verkürzung der Dauer von Erkältungen durch Zink beruht. Die begrenzte Stichprobengröße und das Studiendesign schließen eine endgültige Aussage über die Wirksamkeit von Zink als Behandlung für COVID-19 aus, deuten aber auf die Variablen hin, die zur Bestätigung dieser ersten Ergebnisse in künftigen Studien untersucht werden müssen.",Treatment of SARS-CoV-2 with high dose oral zinc salts: A report on four patients,"Coronavirus 2019 (COVID-19) is a pandemic with substantial mortality and no accepted therapy. We report here on four consecutive outpatients with clinical characteristics (CDC case definition) of and/or laboratory-confirmed COVID-19 who were treated with high dose zinc salt oral lozenges. All four patients experienced significant improvement in objective and symptomatic disease measures after one day of high dose therapy suggesting that zinc therapy was playing a role in clinical recovery. A mechanism for zinc’s effects is proposed based on previously published studies on SARS- CoV-1, and randomized controlled trials assessing zinc shortening of common cold duration. The limited sample size and study design preclude a definitive statement about the effectiveness of zinc as a treatment for COVID-19 but suggest the variables to be addressed to confirm these initial findings in future trials.",Therapeutics,https://www.sciencedirect.com/science/article/pii/S1201971220304410
2020-06-06-medical-hypotheses_j.mehy.2020.109957.md,2020-06-06,Medical Hypotheses,Ist Hesperidin für die Prophylaxe und Behandlung der COVID-19-Infektion unerlässlich?,"SARS-CoV-2 oder COVID-19 stellt die größte globale Belastung dar, die in weniger als sechs Monaten weltweit mehr als 4,7 Millionen Infektionsfälle und 310 000 Todesfälle zur Folge hatte. Man erwartet, dass die Prävalenz dieser pandemischen Krankheit jeden Tag steigt. Die Herausforderung besteht darin, ihre rasche Ausbreitung zu kontrollieren und gleichzeitig nach einer spezifischen Behandlung zu suchen, um die Ergebnisse für die Patienten zu verbessern. Hesperidin ist ein klassisches pflanzliches Arzneimittel, das weltweit seit langem verwendet wird und ein ausgezeichnetes Sicherheitsprofil aufweist. Es wird als Antioxidans und entzündungshemmendes Mittel eingesetzt. Die wenigen verfügbaren Belege sprechen für einen vielversprechenden Einsatz von Hesperidin bei der Prophylaxe und Behandlung von COVID 19. Im Folgenden erörtern wir die möglichen prophylaktischen und therapeutischen Mechanismen von Hesperidin auf der Grundlage früherer und neuerer Erkenntnisse. Hesperidin kann das Eindringen des Coronavirus in die Wirtszellen über ACE2-Rezeptoren blockieren und so die Infektion verhindern. Die antivirale Aktivität von Hesperidin könnte eine Behandlungsmöglichkeit für COVID-19 darstellen, da es die zelluläre Immunität des Wirts gegen die Infektion verbessert und seine gute entzündungshemmende Wirkung bei der Kontrolle des Zytokinsturms helfen kann. Eine Hesperidin-Mischung mit Diosmin, die zusammen mit Heparin verabreicht wird, schützt vor venösen Thromboembolien, was das Fortschreiten der Krankheit verhindern könnte. Auf dieser Grundlage könnte Hesperidin als sinnvolles prophylaktisches Mittel und als vielversprechende adjuvante Behandlungsoption gegen die SARS-CoV-2-Infektion eingesetzt werden.",Is hesperidin essential for prophylaxis and treatment of COVID-19 Infection?,"SARS-CoV-2 or COVID-19 is representing the major global burden that implicated more than 4.7 million infected cases and 310 thousand deaths worldwide in less than 6 months. The prevalence of this pandemic disease is expected to rise every day. The challenge is to control its rapid spread meanwhile looking for a specific treatment to improve patient outcomes. Hesperidin is a classical herbal medicine used worldwide for a long time with an excellent safety profile. Hesperidin is a well-known herbal medication used as an antioxidant and anti-inflammatory agent. Available shreds of evidence support the promising use of hesperidin in prophylaxis and treatment of COVID 19. Herein, we discuss the possible prophylactic and treatment mechanisms of hesperidin based on previous and recent findings. Hesperidin can block coronavirus from entering host cells through ACE2 receptors which can prevent the infection. Anti-viral activity of hesperidin might constitute a treatment option for COVID-19 through improving host cellular immunity against infection and its good anti-inflammatory activity may help in controlling cytokine storm. Hesperidin mixture with diosmin co-administrated with heparin protect against venous thromboembolism which may prevent disease progression. Based on that, hesperidin might be used as a meaningful prophylactic agent and a promising adjuvant treatment option against SARS-CoV-2 infection.",Therapeutics,https://www.sciencedirect.com/science/article/pii/S030698772031358X?via%3Dihub
2020-06-19-frontiers-in-immunology_fimmu.2020.01451.md,2020-06-19,Frontiers in Immunology,"Quercetin und Vitamin C: Eine experimentelle, synergistische Therapie zur Vorbeugung und Behandlung von SARS-CoV-2-bedingten Erkrankungen (COVID-19)","Das Schwere Akute Respiratorische Syndrom Coronavirus-2 (SARS-CoV-2) stellt eine neue globale Bedrohung dar, die die Kapazitäten des Gesundheitswesens weltweit überfordert. Bis zum 27. Mai hat die durch SARS-CoV-2 (COVID-19) verursachte Krankheit weltweit mehr als 340.000 Todesfälle gefordert, davon allein 100.000 in den USA. Die Erforschung und Entwicklung geeigneter pharmakologischer Behandlungen für die Vorbeugung und Behandlung von COVID-19 ist dringend erforderlich. Ascorbinsäure ist ein wichtiges Vitamin, das für das korrekte Funktionieren des Immunsystems notwendig ist. Es spielt eine Rolle bei der Stressreaktion und hat bei der Verabreichung an schwerkranke Menschen vielversprechende Ergebnisse gezeigt. Quercetin ist ein bekanntes Flavonoid, dessen antivirale Eigenschaften in zahlreichen Studien untersucht worden sind. Es gibt Hinweise darauf, dass die gleichzeitige Verabreichung von Vitamin C und Quercetin eine synergistische antivirale Wirkung hat, die auf sich überschneidende antivirale und immunmodulatorische Eigenschaften und die Fähigkeit von Ascorbat, Quercetin zu recyceln, zurückzuführen ist, was dessen Wirksamkeit erhöht. Sichere, kostengünstige Maßnahmen, die eine solide biologische Grundlage haben, sollten im aktuellen Kontext einer globalen Gesundheitspandemie vorrangig für den experimentellen Einsatz eingesetzt werden. Wir präsentieren die aktuellen Belege für den Einsatz von Vitamin C und Quercetin sowohl zur Prophylaxe in Hochrisikogruppen als auch zur Behandlung von COVID-19-Patienten als Ergänzung zu vielversprechenden pharmakologischen Wirkstoffen wie Remdesivir oder Rekonvaleszenzplasma.","Quercetin and Vitamin C: An Experimental, Synergistic Therapy for the Prevention and Treatment of SARS-CoV-2 Related Disease (COVID-19)","Severe Acute Respiratory Syndrome Coronavirus-2 (SARS-CoV-2) represents an emergent global threat which is straining worldwide healthcare capacity. As of May 27th, the disease caused by SARS-CoV-2 (COVID-19) has resulted in more than 340,000 deaths worldwide, with 100,000 deaths in the US alone. It is imperative to study and develop pharmacological treatments suitable for the prevention and treatment of COVID-19. Ascorbic acid is a crucial vitamin necessary for the correct functioning of the immune system. It plays a role in stress response and has shown promising results when administered to the critically ill. Quercetin is a well-known flavonoid whose antiviral properties have been investigated in numerous studies. There is evidence that vitamin C and quercetin co-administration exerts a synergistic antiviral action due to overlapping antiviral and immunomodulatory properties and the capacity of ascorbate to recycle quercetin, increasing its efficacy. Safe, cheap interventions which have a sound biological rationale should be prioritized for experimental use in the current context of a global health pandemic. We present the current evidence for the use of vitamin C and quercetin both for prophylaxis in high-risk populations and for the treatment of COVID-19 patients as an adjunct to promising pharmacological agents such as Remdesivir or convalescent plasma.",Therapeutics,https://www.frontiersin.org/articles/10.3389/fimmu.2020.01451/full
2020-07-08-bmjopen_bmjopen-2020-039519.md,2020-07-08,BMJ Open,Intravenöses hochdosiertes Vitamin C zur Behandlung von schwerem COVID-19: Studienprotokoll für eine multizentrische randomisierte kontrollierte Studie,"Die rasche weltweite Ausbreitung von COVID-19 hat eine globale Gesundheitskrise verursacht. Bislang war die symptomatische unterstützende Behandlung die gängigste Therapie. Berichtet wurde, dass der Mechanismus von COVID-19 mit Zytokinstürmen und nachfolgenden immunogenen Schäden zusammenhängt, insbesondere mit Schäden am Endothel und der Alveolarmembran. Vitamin C (VC), auch bekannt als L-Ascorbinsäure, hat nachweislich antimikrobielle und immunmodulatorische Eigenschaften. Eine hohe Dosis intravenöser VC (HIVC) blockiert nachweislich mehrere Schlüsselkomponenten von Zytokinstürmen, und HIVC erwies sich in klinischen Studien bei Patienten mit bakteriell bedingter Sepsis und akutem Atemnotsyndrom (ARDS) als sicher und in unterschiedlichem Maße wirksam. Daher stellen wir die Hypothese auf, dass HIVC zur Behandlung von ARDS und Multiorganversagen im Zusammenhang mit COVID-19 eingesetzt werden könnte. Die Forscher haben eine multizentrische, prospektive, randomisierte, placebokontrollierte Studie konzipiert, an der 308 Erwachsene teilnehmen sollen, bei denen COVID-19 diagnostiziert und auf die Intensivstation verlegt wurde. Die Teilnehmer erhalten nach dem Zufallsprinzip in sterilem Wasser verdünntes HIVC oder ein Placebo für 7 Tage, sobald sie eingeschrieben sind. Patienten mit einer VC-Allergie in der Vorgeschichte, einer Lungenerkrankung im Endstadium, einer fortgeschrittenen malignen Erkrankung oder einem Glucose-6-Phosphat-Dehydrogenase-Mangel werden ausgeschlossen. Das primäre Ergebnis sind beatmungsfreie Tage innerhalb von 28 Beobachtungstagen. Dies ist eine der ersten klinischen Studien, in denen HIVC zur Behandlung von COVID-19 eingesetzt wird, und sie wird glaubwürdige Daten zur Wirksamkeit und Sicherheit liefern. Wir gehen davon aus, dass HIVC die durch COVID-19 verursachten Zytokinstürme unterdrücken, zur Verbesserung der Lungenfunktion beitragen und das ARDS-Risiko von COVID-19 verringern könnte.",Intravenous high-dose vitamin C for the treatment of severe COVID-19: study protocol for a multicentre randomised controlled trial,"The rapid worldwide spread of COVID-19 has caused a global health crisis. To date, symptomatic supportive care has been the most common treatment. It has been reported that the mechanism of COVID-19 is related to cytokine storms and subsequent immunogenic damage, especially damage to the endothelium and alveolar membrane. Vitamin C (VC), also known as L-ascorbic acid, has been shown to have antimicrobial and immunomodulatory properties. A high dose of intravenous VC (HIVC) was proven to block several key components of cytokine storms, and HIVC showed safety and varying degrees of efficacy in clinical trials conducted on patients with bacterial-induced sepsis and acute respiratory distress syndrome (ARDS). Therefore, we hypothesise that HIVC could be added to the treatment of ARDS and multiorgan dysfunction related to COVID-19. The investigators designed a multicentre prospective randomised placebo-controlled trial that is planned to recruit 308 adults diagnosed with COVID-19 and transferred into the intensive care unit. Participants will randomly receive HIVC diluted in sterile water or placebo for 7 days once enrolled. Patients with a history of VC allergy, end-stage pulmonary disease, advanced malignancy or glucose-6-phosphate dehydrogenase deficiency will be excluded. The primary outcome is ventilation-free days within 28 observational days. This is one of the first clinical trials applying HIVC to treat COVID-19, and it will provide credible efficacy and safety data. We predict that HIVC could suppress cytokine storms caused by COVID-19, help improve pulmonary function and reduce the risk of ARDS of COVID-19.",Therapeutics,https://bmjopen.bmj.com/content/10/7/e039519.long
