filename,date,publisher,title,beschreibung,title,description,group,credit
2021-09-01-sciencedirect_j.nmni.2021.100924.md,2021-09-01,ScienceDirect,"Ivermectin: ein vielseitiges, mit dem Nobelpreis ausgezeichnetes Medikament mit nachgewiesener Wirksamkeit gegen eine neue globale Geißel, COVID-19","Im Jahr 2015 würdigte das Nobelkomitee für Physiologie oder Medizin mit seinem einzigen Preis für die Behandlung von Infektionskrankheiten seit sechs Jahrzehnten die Entdeckung von Ivermectin (IVM), einem vielseitigen Medikament, das gegen einige der verheerendsten Tropenkrankheiten der Welt eingesetzt wird. Seit März 2020, als IVM erstmals gegen eine neue globale Geißel, COVID-19, eingesetzt wurde, haben mehr als 20 randomisierte klinische Studien (RCTs) solche stationären und ambulanten Behandlungen verfolgt. Sechs von sieben Meta-Analysen der RCTs zur IVM-Behandlung, die 2021 veröffentlicht wurden, ergaben eine bemerkenswerte Verringerung der COVID-19-Todesfälle, mit einem durchschnittlichen relativen Sterberisiko von 31 % im Vergleich zu den Kontrollen. Während der massiven IVM-Behandlungen in Peru gingen die überzähligen Todesfälle in den zehn Bundesstaaten mit den umfangreichsten Behandlungen innerhalb von 30 Tagen um durchschnittlich 74 % zurück. Der Rückgang der Todesfälle korrelierte mit dem Ausmaß der IVM-Verteilung in allen 25 Bundesstaaten mit p < 0,002. Ein deutlicher Rückgang der Morbidität durch IVM wurde auch in zwei Tiermodellen beobachtet, und zwar bei SARS-CoV-2 und einem verwandten Betacoronavirus. Der angegebene biologische Mechanismus von IVM, die kompetitive Bindung an das SARS-CoV-2-Spike-Protein, ist wahrscheinlich nicht epitopspezifisch, was möglicherweise zu einer vollständigen Wirksamkeit gegen neu auftretende virale Mutantenstämme führt.","Ivermectin: a multifaceted drug of Nobel prize-honoured distinction with indicated efficacy against a new global scourge, COVID-19","In 2015, the Nobel Committee for Physiology or Medicine, in its only award for treatments of infectious diseases since six decades prior, honoured the discovery of ivermectin (IVM), a multifaceted drug deployed against some of the world’s most devastating tropical diseases. Since March 2020, when IVM was first used against a new global scourge, COVID-19, more than 20 randomized clinical trials (RCTs) have tracked such inpatient and outpatient treatments. Six of seven meta-analyses of IVM treatment RCTs reporting in 2021 found notable reductions in COVID-19 fatalities, with a mean 31% relative risk of mortality vs. controls. During mass IVM treatments in Peru, excess deaths fell by a mean of 74% over 30 days in its ten states with the most extensive treatments. Reductions in deaths correlated with the extent of IVM distributions in all 25 states with p < 0.002. Sharp reductions in morbidity using IVM were also observed in two animal models, of SARS-CoV-2 and a related betacoronavirus. The indicated biological mechanism of IVM, competitive binding with SARS-CoV-2 spike protein, is likely non-epitope specific, possibly yielding full efficacy against emerging viral mutant strains.",Therapeutics,https://www.sciencedirect.com/science/article/pii/S2052297521000883?via%3Dihub
2021-09-07-frontiers-in-nutrition_fnut.2021.674258.md,2021-09-07,Frontiers in Nutrition,Die immunmodulatorische Rolle von Nährstoffen: Wie können sich Lungenfunktionsstörungen verbessern?,"Die Ernährung ist ein wichtiges Instrument, mit dem die Immunantwort bei Infektionskrankheiten moduliert werden kann. Darüber hinaus werden über die Ernährung wichtige Substrate für die Biosynthese von regulatorischen Molekülen der Immunantwort erworben, die den Verlauf und die Behandlung chronischer Lungenerkrankungen wie Asthma und chronisch obstruktiver Lungenerkrankung (COPD) beeinflussen. Auf diese Weise kann die Ernährung den Gesundheitsstatus der Lunge fördern. Eine Reihe von Nährstoffen wie Vitamine (A, C, D und E), Mineralstoffe (Zink, Selen, Eisen und Magnesium), Flavonoide und Fettsäuren spielen eine wichtige Rolle bei der Verringerung des Risikos von chronischen Lungenerkrankungen und Virusinfektionen. Durch ihre antioxidative und entzündungshemmende Wirkung werden die Nährstoffe mit einer besseren Lungenfunktion und einem geringeren Risiko für Komplikationen in Verbindung gebracht, da sie die schädlichen Auswirkungen des Immunsystems während der Entzündungsreaktion verringern können. Darüber hinaus können bioaktive Verbindungen sogar zu epigenetischen Veränderungen beitragen, einschließlich Histon-Deacetylase (HDAC)-Modifikationen, die die Transkription von proinflammatorischen Zytokinen hemmen, was zur Aufrechterhaltung der Homöostase im Zusammenhang mit Infektionen und chronischen Entzündungskrankheiten beitragen kann. Diese Nährstoffe spielen auch eine wichtige Rolle bei der Aktivierung von Immunreaktionen gegen Krankheitserreger, was das Immunsystem bei Infektionen unterstützen kann. Hier geben wir einen aktuellen Überblick über die Rolle von Ernährungsfaktoren und wie sie die Gesundheit der Atemwege beeinflussen können. Daher werden wir die entzündungshemmende Rolle von Flavonoiden, Fettsäuren, Vitaminen und der Mikrobiota aufzeigen, die für die Kontrolle von chronischen Entzündungskrankheiten und Allergien wichtig sind, sowie die antivirale Rolle von Vitaminen, Flavonoiden und Mineralien bei Virusinfektionen der Lunge, wobei wir auf die Mechanismen eingehen, die an jeder Funktion beteiligt sind. Diese Mechanismen sind für die Erörterung der Perspektiven im Zusammenhang mit der Infektion mit dem schweren akuten respiratorischen Syndrom Coronavirus 2 (SARS-CoV-2) und seinen pulmonalen Komplikationen interessant, da Patienten mit einer schweren Erkrankung einen Mangel an Vitaminen, insbesondere an Vitamin D, aufweisen. Auf diese Weise kann ein umfassendes Verständnis der Ernährungseinflüsse die Lungengesundheit der Patienten verbessern.",Immunomodulatory Role of Nutrients: How Can Pulmonary Dysfunctions Improve?,"Nutrition is an important tool that can be used to modulate the immune response during infectious diseases. In addition, through diet, important substrates are acquired for the biosynthesis of regulatory molecules in the immune response, influencing the progression and treatment of chronic lung diseases, such as asthma and chronic obstructive pulmonary disease (COPD). In this way, nutrition can promote lung health status. A range of nutrients, such as vitamins (A, C, D, and E), minerals (zinc, selenium, iron, and magnesium), flavonoids and fatty acids, play important roles in reducing the risk of pulmonary chronic diseases and viral infections. Through their antioxidant and anti-inflammatory effects, nutrients are associated with better lung function and a lower risk of complications since they can decrease the harmful effects from the immune system during the inflammatory response. In addition, bioactive compounds can even contribute to epigenetic changes, including histone deacetylase (HDAC) modifications that inhibit the transcription of proinflammatory cytokines, which can contribute to the maintenance of homeostasis in the context of infections and chronic inflammatory diseases. These nutrients also play an important role in activating immune responses against pathogens, which can help the immune system during infections. Here, we provide an updated overview of the roles played by dietary factors and how they can affect respiratory health. Therefore, we will show the anti-inflammatory role of flavonoids, fatty acids, vitamins and microbiota, important for the control of chronic inflammatory diseases and allergies, in addition to the antiviral role of vitamins, flavonoids, and minerals during pulmonary viral infections, addressing the mechanisms involved in each function. These mechanisms are interesting in the discussion of perspectives associated with severe acute respiratory syndrome coronavirus 2 (SARS-CoV-2) infection and its pulmonary complications since patients with severe disease have vitamins deficiency, especially vitamin D. In addition, researches with the use of flavonoids have been shown to decrease viral replication in vitro. This way, a full understanding of dietary influences can improve the lung health of patients.",Therapeutics,https://www.frontiersin.org/articles/10.3389/fnut.2021.674258/full
2021-09-08-frontiers-in-pediatrics_fped.2021.695703.md,2021-09-08,Frontiers in Pediatrics,COVID-19-Pandemie und verminderte körperliche Aktivität: Gibt es einen Einfluss auf gesunde und asthmatische Kinder?,"Körperliche Aktivität (PA) verbessert nachweislich Asthmasymptome, Lungenfunktion und Lebensqualität und verringert die Entzündung der Atemwege und die bronchiale Reaktionsfähigkeit. Infolge der COVID-19-Pandemie ist die von der Weltgesundheitsorganisation empfohlene Mindestmenge an körperlicher Betätigung - d. h. etwa 60 Minuten pro Tag mit mäßiger bis hoher Intensität - für viele Kinder, insbesondere in städtischen Gebieten, schwer zu erreichen. Kurzfristige Veränderungen der körperlichen Aktivität aufgrund der COVID-19-Pandemie können zur Gewohnheit werden und das Risiko für eine negative Asthmaentwicklung bei Kindern erhöhen. Ein längerer Aufenthalt zu Hause während der COVID-19-Pandemie führt zu einer Verringerung des PA-Niveaus und einer Zunahme des sitzenden Verhaltens, was möglicherweise die Funktion des Immunsystems beeinträchtigt und die Anfälligkeit für Entzündungskrankheiten erhöht. Es gibt jedoch nur wenige Belege für die Auswirkungen von Hausarrest aufgrund von COVID-19 auf die PA und das sitzende Verhalten bei asthmatischen Kindern. Da sich Kinder länger in geschlossenen Räumen aufhalten, stellt die Luftverschmutzung in Innenräumen ein wichtiges Problem dar, das bei einem Hausarrest zu berücksichtigen ist. Diese Übersichtsarbeit soll die verfügbaren Erkenntnisse über die Auswirkungen von verminderter körperlicher Aktivität und vermehrtem sitzenden Verhalten auf Kinder mit Asthma während der COVID-19-Pandemie zusammenfassen. Darüber hinaus werden Strategien zur Förderung der körperlichen Aktivität bei Kindern mit Asthma während der COVID-19-Pandemie vorgeschlagen, wobei auch das Problem der Innenraumluftqualität berücksichtigt wird.",COVID-19 Pandemic and Reduced Physical Activity: Is There an Impact on Healthy and Asthmatic Children?,"Physical activity (PA) has been seen to improve asthma symptoms, lung function, and quality of life, as well as to reduce airway inflammation and bronchial responsiveness. As a consequence of the COVID-19 pandemic, the minimal amount of PA recommended by the World Health Organization—i.e., about 60 min/day of moderate-to-high intensity—is difficult to achieve for many children, particularly those living in urban areas. Short-term changes in PA because of the COVID-19 pandemic may become habitual, increasing the risk of adverse asthma outcomes in children. Indeed, prolonged home confinement during the COVID-19 pandemic reduces PA levels and increases sedentary behaviors, possibly impairing immune system function and increasing susceptibility to inflammatory diseases. However, there is limited evidence regarding the effects of lockdown due to COVID-19 on PA and sedentary behaviors in asthmatic children. Given that children stay longer indoors, indoor air pollution represents a major issue to consider during home confinement. This narrative review aims to summarize the available evidence about the impact of decreased PA and increased sedentary behaviors on children with asthma during the COVID-19 pandemic. In addition, strategies for supporting PA in children with asthma during the COVID-19 pandemic are suggested, also looking at the issue of indoor air quality.",Therapeutics,https://www.frontiersin.org/articles/10.3389/fped.2021.695703/full
2021-09-11-MetabolismOpen_j.metop.2021.100101.md,2021-09-11,Metabolism Open,"Impfstoffinduzierte thrombotische Thrombozytopenie: Das düstere Kapitel einer Erfolgsgeschichte"".","Das Bekanntwerden der seltenen, aber schwerwiegenden und potenziell tödlichen Komplikation der impfstoffinduzierten thrombotischen Thrombozytopenie (VITT) gab Anlass zu Bedenken hinsichtlich der Sicherheit von COVID-19-Impfstoffen und führte in vielen Ländern zu einem Überdenken der Impfstrategien. Nach der Beschreibung von VITT bei Empfängern des adenoviralen Vektorimpfstoffs ChAdOx1 gab eine Überprüfung ähnlicher Fälle nach der Impfung mit Ad26.COV2-S Anlass zu der Frage, ob diese Entität eine potenzielle Klassenwirkung aller adenoviralen Vektorimpfstoffe darstellen könnte. Bei den meisten Fällen handelt es sich um Frauen, die in der Regel jünger als 60 Jahre sind und kurz (5-30 Tage) nach der Impfung eine Thrombozytopenie und thrombotische Manifestationen, gelegentlich an mehreren Stellen, aufweisen. Nach anfänglicher Unsicherheit wurden konkrete Empfehlungen für die Diagnose (klinischer Verdacht, erstes Laborscreening, PF4-Polyanion-Antikörper-ELISA) und die Behandlung der VITT (Nicht-Heparin-Antikoagulanzien, Kortikosteroide, intravenöses Immunglobulin) herausgegeben. Die Mechanismen, die diesem seltenen Syndrom zugrunde liegen, sind derzeit Gegenstand aktiver Forschung und umfassen Folgendes: 1) Produktion von PF4-Polyanion-Autoantikörpern; 2) Eintritt des adenoviralen Vektors in Megakaryozyten und anschließende Expression des Spike-Proteins auf der Thrombozytenoberfläche; 3) direkte Bindung und Aktivierung von Thrombozyten und Endothelzellen durch den adenoviralen Vektor; 4) Aktivierung von Endothel- und Entzündungszellen durch die PF4-Polyanion-Autoantikörper; 5) Vorhandensein eines entzündlichen Co-Signals; und 6) die Häufigkeit von zirkulierenden löslichen Spike-Protein-Varianten nach der Impfung. Neben der Analyse möglicher zugrunde liegender Mechanismen zielt diese Übersichtsarbeit darauf ab, die klinischen und epidemiologischen Merkmale der VITT zusammenzufassen, die aktuellen evidenzbasierten Empfehlungen zur diagnostischen und therapeutischen Abklärung der VITT vorzustellen und neue Dilemmata und Perspektiven zu diskutieren, die nach der Beschreibung dieser Entität entstanden sind. Schlüsselwörter: Adenoviraler Vektor; Adenovirus; COVID-19; SARS-CoV-2; Impfstoff-induzierte thrombotische Thrombozytopenie; Impfstoff",Vaccine induced thrombotic thrombocytopenia: The shady chapter of a success story.,"The recognition of the rare but serious and potentially lethal complication of vaccine induced thrombotic thrombocytopenia (VITT) raised concerns regarding the safety of COVID-19 vaccines and led to the reconsideration of vaccination strategies in many countries. Following the description of VITT among recipients of adenoviral vector ChAdOx1 vaccine, a review of similar cases after Ad26.COV2·S vaccination gave rise to the question whether this entity may constitute a potential class effect of all adenoviral vector vaccines. Most cases are females, typically younger than 60 years who present shortly (range: 5–30 days) following vaccination with thrombocytopenia and thrombotic manifestations, occasionally in multiple sites. Following initial incertitude, concrete recommendations to guide the diagnosis (clinical suspicion, initial laboratory screening, PF4-polyanion-antibody ELISA) and management of VITT (non-heparin anticoagulants, corticosteroids, intravenous immunoglobulin) have been issued. The mechanisms behind this rare syndrome are currently a subject of active research and include the following: 1) production of PF4-polyanion autoantibodies; 2) adenoviral vector entry in megacaryocytes and subsequent expression of spike protein on platelet surface; 3) direct platelet and endothelial cell binding and activation by the adenoviral vector; 4) activation of endothelial and inflammatory cells by the PF4-polyanion autoantibodies; 5) the presence of an inflammatory co-signal; and 6) the abundance of circulating soluble spike protein variants following vaccination. Apart from the analysis of potential underlying mechanisms, this review aims to synopsize the clinical and epidemiologic features of VITT, to present the current evidence-based recommendations on diagnostic and therapeutic work-up of VITT and to discuss new dilemmas and perspectives that emerged after the description of this entity. Keywords: Adenoviral vector; Adenovirus; COVID-19; SARS-CoV-2; Vaccine induced thrombotic thrombocytopenia; Vaccine",Vaccines,https://www.sciencedirect.com/science/article/pii/S2589936821000256?via%3Dihub
2021-09-13-international-journal-of-molecular-sciences_ijms22189889.md,2021-09-13,International Journal of Molecular Sciences,Entzündungshemmende Wirkung von Interleukin-6 aus der Muskulatur und seine Beteiligung am Fettstoffwechsel,"Interleukin (IL)-6 wird seit seiner Entdeckung auf seine Rolle bei Gesundheit und Krankheit untersucht. Es ist eines der wichtigsten proinflammatorischen Zytokine. IL-6 wurde als ein verschlimmernder Faktor bei Coronavirus-Erkrankungen beschrieben. In den letzten Jahren wurde deutlich, dass die Funktion des aus Muskeln gewonnenen IL-6 eine andere ist als die bisher berichtete. Bei körperlicher Betätigung kontrahieren die Skelettmuskeln, und dabei werden mehrere bioaktive Substanzen, die so genannten Myokine, von den Muskeln ausgeschüttet. Viele Berichte haben gezeigt, dass IL-6 das am häufigsten vorkommende Myokin ist. Interessanterweise wurde darauf hingewiesen, dass IL-6 als Myokin und als entzündungsförderndes Zytokin gegensätzliche Rollen spielt. In dieser Übersichtsarbeit wird erörtert, warum IL-6 unterschiedliche Funktionen hat, wie Hyper-IL-6 über den löslichen IL-6-Rezeptor (sIL-6R) signalisiert wird und welche Rolle das lösliche Glykoprotein 130 bei der suppressiven Wirkung von Hyper-IL-6 spielt. Darüber hinaus wird die Beteiligung von Molekülen der Familie der Desintegrine und Metalloproteasen an der Sekretion von sIL-6R beschrieben. Eine der Funktionen des aus Muskeln gewonnenen IL-6 ist der Lipidstoffwechsel in der Leber. Die Unterschiede zwischen den Funktionen von IL-6 als proinflammatorisches Zytokin und den Funktionen von IL-6 aus dem Muskel sind jedoch unklar. Obwohl die Beteiligung von Myokinen am Fettstoffwechsel in Adipozyten bereits diskutiert wurde, ist über die direkte Beziehung zwischen nichtalkoholischer Fettlebererkrankung und aus Muskeln gewonnenem IL-6 wenig bekannt. In dieser Übersichtsarbeit wird zum ersten Mal die Beziehung zwischen der Funktion von IL-6 bei Krankheiten und der Funktion von IL-6 aus dem Muskel erörtert, wobei der Schwerpunkt auf der IL-6-Signalübertragung und dem Fettstoffwechsel in der Leber liegt.",Anti-Inflammatory Effect of Muscle-Derived Interleukin-6 and Its Involvement in Lipid Metabolism,"Interleukin (IL)-6 has been studied since its discovery for its role in health and diseases. It is one of the most important pro-inflammatory cytokines. IL-6 was reported as an exacerbating factor in coronavirus disease. In recent years, it has become clear that the function of muscle-derived IL-6 is different from what has been reported so far. Exercise is accompanied by skeletal muscle contraction, during which, several bioactive substances, collectively named myokines, are secreted from the muscles. Many reports have shown that IL-6 is the most abundant myokine. Interestingly, it was indicated that IL-6 plays opposing roles as a myokine and as a pro-inflammatory cytokine. In this review, we discuss why IL-6 has different functions, the signaling mode of hyper-IL-6 via soluble IL-6 receptor (sIL-6R), and the involvement of soluble glycoprotein 130 in the suppressive effect of hyper-IL-6. Furthermore, the involvement of a disintegrin and metalloprotease family molecules in the secretion of sIL-6R is described. One of the functions of muscle-derived IL-6 is lipid metabolism in the liver. However, the differences between the functions of IL-6 as a pro-inflammatory cytokine and the functions of muscle-derived IL-6 are unclear. Although the involvement of myokines in lipid metabolism in adipocytes was previously discussed, little is known about the direct relationship between nonalcoholic fatty liver disease and muscle-derived IL-6. This review is the first to discuss the relationship between the function of IL-6 in diseases and the function of muscle-derived IL-6, focusing on IL-6 signaling and lipid metabolism in the liver.",Therapeutics,https://www.mdpi.com/1422-0067/22/18/9889/htm
2021-09-13-the-lancet_S0140-6736(21)02046-8.md,2021-09-13,The Lancet,Überlegungen zur Verstärkung der Immunantwort auf den COVID-19-Impfstoff,"Eine neue Welle von COVID-19-Fällen, die durch die hochgradig übertragbare Delta-Variante verursacht werden, verschärft die weltweite Krise der öffentlichen Gesundheit und hat zu Überlegungen über die mögliche Notwendigkeit und den optimalen Zeitpunkt von Auffrischungsimpfungen für geimpfte Bevölkerungsgruppen geführt. Der Gedanke, die Zahl der COVID-19-Fälle durch eine Verstärkung der Immunität bei Geimpften weiter zu verringern, ist zwar verlockend, doch sollte jede diesbezügliche Entscheidung evidenzbasiert sein und die Vorteile und Risiken für den Einzelnen und die Gesellschaft berücksichtigen. COVID-19-Impfstoffe sind nach wie vor wirksam gegen schwere Erkrankungen, auch gegen die durch die Delta-Variante verursachte. Die meisten Beobachtungsstudien, auf die sich diese Schlussfolgerung stützt, sind jedoch vorläufig und aufgrund möglicher Verwechslungen und selektiver Berichterstattung schwer genau zu interpretieren. Eine sorgfältige und öffentliche Prüfung der sich entwickelnden Daten ist erforderlich, um sicherzustellen, dass Entscheidungen über das Boosting eher auf zuverlässigen wissenschaftlichen Erkenntnissen als auf politischen Erwägungen beruhen. Selbst wenn die Auffrischungsimpfung nachweislich das mittelfristige Risiko einer schweren Erkrankung verringert, könnten die derzeitigen Impfstoffvorräte mehr Leben retten, wenn sie in zuvor ungeimpften Bevölkerungsgruppen eingesetzt werden, als wenn sie als Auffrischungsimpfung in geimpften Bevölkerungsgruppen verwendet werden.",Considerations in boosting COVID-19 vaccine immune responses,"A new wave of COVID-19 cases caused by the highly transmissible delta variant is exacerbating the worldwide public health crisis, and has led to consideration of the potential need for, and optimal timing of, booster doses for vaccinated populations. Although the idea of further reducing the number of COVID-19 cases by enhancing immunity in vaccinated people is appealing, any decision to do so should be evidence-based and consider the benefits and risks for individuals and society. COVID-19 vaccines continue to be effective against severe disease, including that caused by the delta variant. Most of the observational studies on which this conclusion is based are, however, preliminary and difficult to interpret precisely due to potential confounding and selective reporting. Careful and public scrutiny of the evolving data will be needed to assure that decisions about boosting are informed by reliable science more than by politics. Even if boosting were eventually shown to decrease the medium-term risk of serious disease, current vaccine supplies could save more lives if used in previously unvaccinated populations than if used as boosters in vaccinated populations.",Vaccines,https://www.thelancet.com/journals/lancet/article/PIIS0140-6736(21)02046-8/fulltext
2021-09-14-sciencedirect_j.toxrep.2021.08.010.md,2021-09-14,ScienceDirect,Warum impfen wir Kinder gegen COVID-19?,"Höhepunkte: Die meisten COVID-19-Todesfälle pro Kopf treten bei älteren Menschen mit hohem Krankheitswert auf. Pro-Kopf-Todesfälle durch COVID-19 sind bei Kindern vernachlässigbar. Die klinischen Studien für diese Impfungen waren sehr kurz. Klinische Studien befassten sich nicht mit den langfristigen Auswirkungen, die für Kinder am wichtigsten sind. VAERS berichtet über hohe Todesfälle nach der Impfung (sehr kurzfristig).",Why are we vaccinating children against COVID-19?,Highlights: Bulk of COVID-19 per capita deaths occur in elderly with high comorbidities. Per capita COVID-19 deaths are negligible in children. Clinical trials for these inoculations were very short-term. Clinical trials did not address long-term effects most relevant to children. High post-inoculation deaths reported in VAERS (very short-term).,Vaccines,https://www.sciencedirect.com/science/article/pii/S221475002100161X?via%3Dihub
